{
  "$schema": "https://json-schema.org/draft/2020-12/schema",
  "$id": "https://spec.doubak.com/canonical/v1/subject.schema.json",
  "title": "doubak canonical v1 — 一个作品（subjects.ndjson 的一行）",
  "description": "豆瓣的作品条目：电影、书、专辑、游戏、舞台剧。\n\n【与用户内容分开存，这一条不可违反】用户写的东西（标记、短评、评分、标签）与作品目录数据的留存期限、删除语义、法律处境都不同。混进一张表，「导出你自己的数据」就再也说不清导的是什么。\n\n【它是缓存，不是圣物】作品数据随时可以整个删掉，从 WARC 重新解析出来——判据与 bundle 那边的 catalog-* 段一致：谁上传的。用户的标记删了就没了，作品条目只要豆瓣还在就能重抓。\n\n因此这个 schema 刻意【薄】：只放能从页面上直接读到、且不需要任何推断的东西。拆解 raw_meta、补外部链接、猜语言标签——全部归 enricher。",

  "type": "object",
  "required": ["canonical_version", "medium", "id", "revisions"],
  "additionalProperties": true,

  "properties": {
    "canonical_version": { "$ref": "common.schema.json#/$defs/canonical_version" },
    "medium": { "$ref": "common.schema.json#/$defs/medium" },

    "id": {
      "type": "string",
      "description": "豆瓣的作品 id。同一个数字在不同媒介下可能撞车，所以主键是 (medium, id) 而不是 id。"
    },

    "url": { "type": ["string", "null"] },

    "upstream_deleted": {
      "type": "boolean",
      "default": false,
      "description": "豆瓣删掉了这个作品条目。\n\n【删掉的是作品，不是用户的标记】——标记还在，评分、标签、短评全在。实测电影 8 条、游戏 7 条。\n\n此时 `title` 必须是 null：页面上写的「未知电影」/「未知游戏」是豆瓣的占位符，不是作品名。存进去它会被当真名显示、被 enricher 拿去外部检索、被导出到 NeoDB。"
    },

    "revisions": {
      "type": "array",
      "minItems": 1,
      "description": "与标记同理：只在内容变了的时候追加，不是每次观测追加。\n\n作品数据比标记更常变（豆瓣会补演员、改分类），但那不是用户的编辑——下游要能把两者分开，所以两边分开存修订。",
      "items": { "$ref": "#/$defs/revision" }
    }
  },

  "$defs": {
    "revision": {
      "type": "object",
      "required": ["parser_version", "first_observed_at", "last_observed_at", "fields", "digests", "observations"],
      "additionalProperties": true,
      "properties": {
        "parser_version": { "$ref": "common.schema.json#/$defs/parser_version" },
        "first_observed_at": { "$ref": "common.schema.json#/$defs/timestamp" },
        "last_observed_at": { "$ref": "common.schema.json#/$defs/timestamp" },

        "fields": {
          "type": "object",
          "additionalProperties": true,
          "properties": {
            "title": {
              "type": ["string", "null"],
              "description": "作品名，原样保留。\n\n【上游条目被删时必须是 null】见 upstream_deleted。"
            },
            "aliases": {
              "type": ["array", "null"],
              "items": { "type": "string" },
              "description": "又名。豆瓣用 ` / ` 分隔，原样切开即可——这一处切分是安全的，因为它是同一类东西的列表，不是异构字段的拼接（对比 raw_meta）。\n\n【只有作品详情页上有】列表页没有这一栏，所以要读详情页才拿得到。实测 2940 个作品里 2011 个有：电影 1970/2102（94%）、音乐 41/84（49%）、书与游戏与舞台剧 0——后三类的页面上根本没有这一栏。\n\n【null 与空数组是两件事】null = 没读过它的详情页；[] = 读过了，页面上确实没有。混成一个的话，补抓详情页之后会冒出一批看起来像编辑的修订。\n\n【它是搜索里最有用的一项】装着的是台译名、港译名与原文名：「重返寂静岭」的又名是「重返沉默之丘(台) / 重返鬼魅山房 / 寂静岭2真人版」。记得住其中一个却想不起大陆译名的人，没有它就什么都搜不到。\n\n【不得猜语言标签】又名里混着粤语、闽南语、英语与各种转写，全都不带标注。`lang` 一律 null，语言识别属于 enricher，产出带 source 与置信度、可以重跑。写错的标签在源页面消失之后无法挽回——CLAUDE.md 明令这一条。"
            },
            "info": {
              "type": ["object", "null"],
              "additionalProperties": { "type": "array", "items": { "type": "string" } },
              "description": "作品详情页 `#info` 那一整块带标签的字段，**键用豆瓣自己的标签原样存**：`{\"导演\": [\"克里斯托夫·甘斯\"], \"制片国家/地区\": [\"法国\", \"美国\"]}`。\n\n【不翻译、不归一化、不跨媒介统一】电影的「导演」与书的「作者」是不是同一个概念，那是 enricher 的判断（产出带 source 与置信度、可以重跑）；解析器的产出会被当作「页面当时就是这么说的」，在这一层做映射等于把猜测冒充成观测。所以这是个**开放词表的映射**，读者遇到不认识的键必须原样保留。\n\n【实测覆盖】电影 2094/2102、书 145/145、音乐 84/84；游戏与舞台剧 0——它们的页面上根本没有 `#info` 这一块。常见键：电影 制片国家/地区·语言·类型·导演·主演·IMDb·编剧·又名·上映日期·片长；书 ISBN·作者·出版年·出版社·页数·定价·装帧·译者；音乐 发行时间·出版者·介质·专辑类型·唱片数·条形码·流派。\n\n【它不替代 raw_meta】raw_meta 是**列表页**那一行的原样记录，info 来自**详情页**；两者来自不同的捕获、也可能不一致，而「页面当时就是这么说的」两边都算数。\n\n【值按 ` / ` 切，不按裸 `/` 切】实测：裸斜杠会把 `犯罪101(港/台)` 切成 `犯罪101(港` 与 `台)`，把 `2026-01-23(美国/中国大陆)` 切成两半——`(港/台)` 是中文里「港台译名相同」的常用写法，斜杠两侧没有空格。4022 张有又名的页面上，裸切比正确切法多出 176 条，全是切坏的。\n\n【必须限定在 `#info` 之内】`span.pl` 在页面别处还用来标评论区的用户名，越界会把几十个陌生人的 id 当成字段名存进档案主人的 canonical。"
            },
            "cover_url": {
              "type": ["string", "null"],
              "description": "封面图的 URL，原样保留（含尺寸参数与 CDN 分片，不归一化）。\n\n图片字节本身在 bundle 的 catalog-* 段里，通过 observations 的 capture_ids 可达。这里只存 URL——canonical 是文本，不装二进制。\n\n【1.1 起：它没有摘要，判据是 cover_url_key】所以【它不参与修订判定】，也因此【它不保证是最新观测到的那一个】：分片变了而海报没变时不会开新修订，这一条留着的是该修订开张时看到的那个值。这是对的——一条修订的 fields 就是「first_observed_at 那一刻页面这么说」，为一个字段破例会让读者读错另外二十个。最新那个原始值一个字节都没丢，它在 WARC 里。\n\n【实测这不是噪声，是豆瓣真的挪过一次图】436197 条图片路径里，同一份档案内主机不一致的 0 条；589 张海报的主机变过，每张只变一次、没有一张换回去。所以它属于「真实但没有意义的变化」那一类（同 `(N 有用)` 计数、`1740人浏览`），不是「每次渲染都不一样」那一类。"
            },
            "cover_url_key": {
              "type": ["string", "null"],
              "description": "cover_url 的【索引】：把量过的 CDN 分片主机抹平之后的结果。\n\n【事实与索引并存，索引不覆盖事实】——与 bundle 的 url / url_key 是同一条规矩，连理由都一样：将来发现新的分片家族可以对存量重算 key，而 cover_url 永远不动。\n\n【规则只认量过的那一族，其余原样不动】`^https?://img\\d+\\.doubanio\\.com/` 的主机换成 `img.doubanio.com`（一个占位主机，【不要去取它】）；别的形状一律照抄。实测档案里除 img1/img2/img3/img9 之外还有 `qnmob3.doubanio.com`，所以这里【不得】把图片主机当成闭集——这条在 CLAUDE.md 里是明令。\n\n【只许抹掉不携带身份的部分】主机可以抹，是因为路径里的图片 id 已经唯一标识了这张图；实测 5820 个原始值收成 5231 个 key，589 个 key 各吃掉一个原始值，而【一个 key 底下出现两条不同路径的：0 个】。尺寸段（s_ratio_poster / m / small）【携带身份】——不同尺寸是不同的字节——所以它绝不能被抹掉，抹了就是两张不同的图被静默并成一张。\n\n【这里证不了的一件事，写下来】档案里没有任何一条路径被从两个主机各抓过一次（11997 条资源捕获 / 3108 条路径 / 0 条），所以「几个分片提供的字节完全相同」本地无法证实。因此这个 key 只用来做判据，绝不用来【改写】cover_url——那才需要那个证据。"
            },
            "raw_meta": {
              "type": ["string", "null"],
              "description": "那一行无标签的 `/` 分隔元信息，原样存字符串。理由见 mark.schema.json 里同名字段：电影 2090 条里出现过 43 种段数，没有位置模式可言。"
            }
          }
        },

        "digests": {
          "type": "object",
          "additionalProperties": { "$ref": "common.schema.json#/$defs/digest" },
          "description": "逐字段摘要，【键必须与 fields 的键一致】，只有下面这一处例外。\n\n【1.1 起：cover_url 没有摘要】它是事实，判据是 cover_url_key（见那一条）。一个没有摘要的字段，含义是【它不参与修订判定】——这是个显式的声明，不是漏写：validate.py 会核对这组键，多一个少一个都报错，所以「漏算了一个摘要」不会伪装成「这个字段不参与判定」。\n\n【为什么不是把摘要改成按 key 算】那样 digests[k] 就不再是 fields[k] 的摘要了，而且【只有这一个字段】这样——2040 年读这份数据的人得先读到某处声明才知道。缺一个键是看得见的，重新定义一个键的含义是看不见的。"
        },

        "observations": {
          "type": "array",
          "minItems": 1,
          "items": { "$ref": "common.schema.json#/$defs/observation" }
        }
      }
    }
  }
}
